{
  "x-version": "1.4.0",
  "x-owner": "evan",
  "x-generated": "2026-10-16 (pkg12: release_calendar_series + alignment per live pair for the point-in-time per-period gate; floors unchanged)",
  "governing_standard": "docs/lead-grid-frequency-standard.md",
  "notes": "Per-pair frequency record mandated by the Lead-Grid Frequency Standard (adopted 2026-07-14) \u00a7 'Enforcement'. For every REGISTERED pair (one entry per app/pair_configs/*_config.py) this records the SIGNAL's native release frequency, its publication lag, the lead axis that frequency implies (Step 1 HARD RULE), and the anchored grid (Step 3). scripts/gate_lead_axis.py asserts each pair's lead artifacts (lead tournament CSV, lead_sharpe_distribution chart, lead_correlation) sit on the axis recorded here. The load-bearing check: a DAILY-signal pair must NOT carry a MONTHLY-axis lead chart (the hy_ig class of error). signal_frequency is the classification of record; observed_winner_lead_unit is the winner_summary.lead_unit at authoring time, kept as an audit cross-check. lead_floor / publication_lag are REFERENCE metadata for scripts/gate_lead_axis.py (axis only). Since 2026-10-16 the floors ARE enforced by scripts/gate_lead_floor.py: lead_floor_effective is the strict floor on the effective lag (lead + position_shift) and lead_floor = lead_floor_effective - position_shift. Archived pairs (*_archived) and superseded versions (hy_ig_spy_v1) are intentionally excluded: not registered, not deployed. DEBT FLAG: the 4 daily Class-A pairs currently carry a MONTHLY-axis lead tournament + chart (a monthly L0-12 resample bolted onto a daily-traded winner); they are recorded here as 'daily' and are EXPECTED to FAIL the gate until rebuilt on the daily axis (rollout item 1). t10y3m_spy and petrol_inv_spy derive from higher-frequency native sources but are processed and deployed end-to-end on a monthly axis; they are recorded as 'monthly' (internally coherent) and flagged for the item-3 monthly re-validation. Since 2026-10-16 (pkg12) each live pair also records release_calendar_series (series id in data/release_calendar/release_calendar.csv, or rule:market_close / rule:next_business_day for daily data) and alignment (fixed_lag | pit_asof); scripts/gate_lead_floor.py --mode per-period (default) counts backtest periods in which a fixed lag uses a reading not yet released; --mode floor keeps the fixed effective-lag check.",
  "axis_unit_map": {
    "daily": "trading_days",
    "weekly": "weeks",
    "monthly": "months",
    "quarterly": "quarters"
  },
  "pairs": {
    "gold_copper_xli": {
      "signal_frequency": "daily",
      "signal_description": "Gold/copper price ratio (daily market data)",
      "publication_lag": "none (observed at market close)",
      "real_time": true,
      "lead_axis": "trading_days",
      "lead_floor": 0,
      "lead_grid": [
        0,
        1,
        5,
        21,
        63,
        126,
        252
      ],
      "observed_winner_lead_unit": "days",
      "class": "daily",
      "note": "DEBT: primary lead tournament + lead_sharpe_distribution chart are on a monthly L0-12 resample axis; winner is daily 0-lead. EXPECTED gate FAIL until rebuilt on the daily axis (rollout item 1).",
      "floor_basis": "STRICT floor (standard Step 2, amended 2026-10-16): effective lag E = lead + position_shift >= 1 (real-time market data observed at the close: the close of day t can only drive the t -> t+1 return). Target encoding = L0 + pos.shift(1), the fix on branch fix261015_gold_copper_l0_lookahead (pkg4); on this branch the pipeline still trades L0 with no extra shift, so gate_lead_floor FAILs (alignment mismatch + effective lag 0) until pkg4 lands. Evidence: _pws/lead-lesandro/pkg9_strict_floor/release_lag_evidence.csv. Grid unchanged.",
      "conformed": true,
      "position_shift": 1,
      "lead_floor_effective": 1,
      "release_calendar_series": "rule:market_close",
      "alignment": "fixed_lag"
    },
    "hy_ig_spy": {
      "signal_frequency": "daily",
      "signal_description": "HY-IG credit spread differential (daily market data)",
      "publication_lag": "ICE BofA OAS (FRED BAMLH0A0HYM2, BAMLC0A0CM) posts about 1 business day after the value date; the value dated t is not known at close t",
      "real_time": false,
      "lead_axis": "trading_days",
      "lead_floor": 1,
      "lead_grid": [
        1,
        5,
        21,
        63,
        126,
        252
      ],
      "observed_winner_lead_unit": "days",
      "class": "daily",
      "note": "Daily-axis lead tournament (lead_days) since 2026-07-15. 2026-10-16: floored at L1 + position shift 1 for the OAS publication lag; L0 removed from the traded grid. HMM/MS regime signals are IS-fit and forward-filtered (scripts/_regime_causal.py).",
      "floor_basis": "STRICT floor (standard Step 2, amended 2026-10-16): effective lag E = lead + position_shift >= 2 (smallest E with first_release(M) <= period_end(M+E-1) at the 90th percentile); lead_floor 1 = 2 - position_shift 1. Evidence: ICE BofA OAS: FRED posts the value dated t on the next business day (ALFRED daily realtime_start is stamped at the observation date, so not usable here); registry decision fix261016_hmm_causal; _pws/lead-lesandro/pkg9_strict_floor/release_lag_evidence.csv. Grid unchanged.",
      "conformed": true,
      "position_shift": 1,
      "lead_floor_effective": 2,
      "release_calendar_series": "rule:next_business_day",
      "alignment": "fixed_lag"
    },
    "vix_vix3m_spy": {
      "signal_frequency": "daily",
      "signal_description": "VIX/VIX3M volatility term-structure ratio (daily market data)",
      "publication_lag": "none (observed at market close)",
      "real_time": true,
      "lead_axis": "trading_days",
      "lead_floor": 0,
      "lead_grid": [
        0,
        1,
        5,
        21,
        63,
        126,
        252
      ],
      "observed_winner_lead_unit": "days",
      "class": "daily",
      "note": "DEBT: primary lead tournament + chart on a monthly L0-12 resample axis; winner is daily 0-lead. EXPECTED gate FAIL until rebuilt on the daily axis (rollout item 1).",
      "floor_basis": "STRICT floor (standard Step 2, amended 2026-10-16): effective lag E = lead + position_shift >= 1 (smallest E with first_release(M) <= period_end(M+E-1) at the 90th percentile); lead_floor 0 = 1 - position_shift 1. Evidence: real-time market prices observed at the close (no publication lag); _pws/lead-lesandro/pkg9_strict_floor/release_lag_evidence.csv. Grid unchanged.",
      "conformed": true,
      "position_shift": 1,
      "lead_floor_effective": 1,
      "release_calendar_series": "rule:market_close",
      "alignment": "fixed_lag"
    },
    "phlxsox_spy": {
      "signal_frequency": "daily",
      "signal_description": "PHLX Semiconductor (SOX) relative strength (daily market data)",
      "publication_lag": "none (observed at market close)",
      "real_time": true,
      "lead_axis": "trading_days",
      "lead_floor": 1,
      "lead_grid": [
        1,
        5,
        21,
        63,
        126,
        252
      ],
      "observed_winner_lead_unit": "days",
      "class": "daily",
      "note": "DEBT: primary lead tournament + chart on a monthly L0-12 resample axis; winner is daily 63-day lead. EXPECTED gate FAIL until rebuilt on the daily axis (rollout item 1). v2 gate: floor 1, grid [1,5,21,63,126,252] matches pipeline (no L0, no extra position shift).",
      "floor_basis": "STRICT floor (standard Step 2, amended 2026-10-16): effective lag E = lead + position_shift >= 1 (smallest E with first_release(M) <= period_end(M+E-1) at the 90th percentile); lead_floor 1 = 1 - position_shift 0. Evidence: real-time market prices observed at the close (no publication lag); _pws/lead-lesandro/pkg9_strict_floor/release_lag_evidence.csv. Grid unchanged.",
      "conformed": true,
      "position_shift": 0,
      "lead_floor_effective": 1,
      "release_calendar_series": "rule:market_close",
      "alignment": "fixed_lag"
    },
    "eci_total_comp_spy": {
      "signal_frequency": "quarterly",
      "signal_description": "Employment Cost Index, total compensation (BLS, quarterly)",
      "publication_lag": "BLS, ~1 month after quarter-end (ALFRED median 30.5 d, p90 31 d); released in the following quarter",
      "real_time": false,
      "lead_axis": "quarters",
      "lead_floor": 2,
      "lead_grid": [
        2,
        3,
        4,
        5
      ],
      "observed_winner_lead_unit": "quarters",
      "class": "quarterly",
      "note": "Grid extended to L0-8 (beyond the L0-4 default) with rationale per Step 3; coherent quarters axis end-to-end.",
      "floor_basis": "STRICT floor (standard Step 2, amended 2026-10-16): effective lag E = lead + position_shift >= 2 (smallest E with first_release(M) <= period_end(M+E-1) at the 90th percentile); lead_floor 2 = 2 - position_shift 0. Evidence: ALFRED first-vintage realtime_start, ref periods 2018-01..2026-09; _pws/lead-lesandro/pkg9_strict_floor/release_lag_evidence.csv. Grid truncated from the bottom (top not extended, protocol D2): 1..5 -> 2..5.",
      "conformed": false,
      "position_shift": 0,
      "lead_floor_effective": 2,
      "release_calendar_series": "ECIALLCIV",
      "alignment": "fixed_lag"
    },
    "busloans_spy": {
      "signal_frequency": "monthly",
      "signal_description": "Commercial & industrial loans, BUSLOANS (FRED, monthly)",
      "publication_lag": "Fed H.8, ~12 days after month-end (ALFRED median 12 d, p90 15 d); released in M+1",
      "real_time": false,
      "lead_axis": "months",
      "lead_floor": 2,
      "lead_grid": [
        2,
        3,
        4,
        5,
        6,
        7,
        8,
        9,
        10,
        11,
        12,
        13
      ],
      "observed_winner_lead_unit": "months",
      "class": "monthly",